<?xml version="1.0" encoding="UTF-8"?>
<!-- <!DOCTYPE QLTour SYSTEM "qltour.dtd"> -->

<!-- Viết thêm mỗi bảng ít nhất 20 dòng. Viết dữ liệu thật, hợp lí -->
<QLTour>
    <!-- Danh sách tour -->
    <DSTour>
        <Tour maTour="T001" maHdv="HDV001">
            <!--maHdv IDREF maHdv cua HuongDanVien-->
            <tenTour>Tour Hà Nội</tenTour>
            <moTa>Tour thăm quan Hà Nội - Hạ Long 4 ngày 3 đêm</moTa>
            <ngayBatDau>1-10-2025</ngayBatDau>
            <ngayKetThuc>4-10-2025</ngayKetThuc>
            <DSDiaDiem>
                <DiaDiem-ref maDiaDiem="DD001"/>
                <DiaDiem-ref maDiaDiem="DD002"/>
            </DSDiaDiem>
            <lichTrinh>
                Ngày 1: Tham quan Hồ Gươm, Lăng Bác.
                Ngày 2: Tham quan Cầu Rồng, Bà Nà Hills.
                Ngày 3: Tham quan Vịnh Hạng Long.
                Ngày 4: Tự do tham quan, mua sắm.
            </lichTrinh>
            <DSChiTietKhachSan>
                <ChiTietKhachSan maCTKS="CTKS001" maKS="KS001">
                    <soLuongPhong>10</soLuongPhong>
                    <ngayCheckIn>1-10-2025</ngayCheckIn>
                    <ngayCheckOut>2-10-2025</ngayCheckOut>
                </ChiTietKhachSan>
                <ChiTietKhachSan maCTKS="CTKS002" maKS="KS002">
                    <soLuongPhong>10</soLuongPhong>
                    <ngayCheckIn>3-10-2025</ngayCheckIn>
                    <ngayCheckOut>4-10-2025</ngayCheckOut>
                </ChiTietKhachSan>
            </DSChiTietKhachSan>
            <DSVanChuyen>
                <VanChuyen>
                    <loaiPhuongTien>Máy Bay</loaiPhuongTien>
                    <thoiGianXuatPhat>06:00 01-10-2025</thoiGianXuatPhat>
                    <thoiGianKetThuc>08:00 01-10-2025</thoiGianKetThuc>
                    <diemXuatPhat>Sân bay Cần Thơ</diemXuatPhat>
                    <diemKetThuc>Sân bay Nội Bài</diemKetThuc>
                    <hangVanChuyen>Vietnam Airline</hangVanChuyen>
                </VanChuyen>
                <VanChuyen>
                    <loaiPhuongTien>Xe khách</loaiPhuongTien>
                    <thoiGianXuatPhat>06:00 03-10-2025</thoiGianXuatPhat>
                    <thoiGianKetThuc>08:00 04-10-2025</thoiGianKetThuc>
                    <diemXuatPhat>... Hà Nội</diemXuatPhat>
                    <diemKetThuc>... Hạ Long</diemKetThuc>
                    <hangVanChuyen>Vietnam Airline</hangVanChuyen>
                </VanChuyen>
                <VanChuyen>
                    <loaiPhuongTien>Máy Bay</loaiPhuongTien>
                    <thoiGianXuatPhat>18:00 04-10-2025</thoiGianXuatPhat>
                    <thoiGianKetThuc>20:00 04-10-2025</thoiGianKetThuc>
                    <diemXuatPhat>Sân bay Nội Bài</diemXuatPhat>
                    <diemKetThuc>Sân bay Cần Thơ</diemKetThuc>
                    <hangVanChuyen>Vietnam Airline</hangVanChuyen>
                </VanChuyen>
            </DSVanChuyen>
        </Tour>
        <Tour maTour="T002" maHdv="HDV002">
            <tenTour>Tour Đà Nẵng</tenTour>
            <moTa>Tour khám phá Đà Nẵng 4 ngày 3 đêm</moTa>
            <ngayBatDau>5-11-2025</ngayBatDau>
            <ngayKetThuc>8-11-2025</ngayKetThuc>
            <DSDiaDiem>

            </DSDiaDiem>
        </Tour>
    </DSTour>

    <!-- Danh sách địa điểm -->
    <DSDiaDiem>
        <DiaDiem maDiaDiem="DD001">
            <tenDiaDiem>Hồ Gươm</tenDiaDiem>
            <diaChi>Hà Nội</diaChi>
            <moTa>Lăng Bác.</moTa>
        </DiaDiem>
        <DiaDiem maDiaDiem="DD002">
            <tenDiaDiem>Cầu Rồng</tenDiaDiem>
            <diaChi>Đà Nẵng</diaChi>
            <moTa>Mô tả về Lăng Bác.</moTa>
        </DiaDiem>
        <DiaDiem maDiaDiem="DD003">
            <tenDiaDiem>Bà Nà Hills</tenDiaDiem>
            <diaChi>Đà Nẵng</diaChi>
            <moTa>...</moTa>
        </DiaDiem>
        <DiaDiem maDiaDiem="DD004">
            <tenDiaDiem>Phố cổ Hội An</tenDiaDiem>
            <diaChi>Quảng Nam</diaChi>
            <moTa>...</moTa>
        </DiaDiem>
        <DiaDiem maDiaDiem="DD005">
            <tenDiaDiem>Đại Nội Huế</tenDiaDiem>
            <diaChi>Huế</diaChi>
            <moTa>...</moTa>
        </DiaDiem>
        <DiaDiem maDiaDiem="DD006">
            <tenDiaDiem>Vinpearl Nha Trang</tenDiaDiem>
            <diaChi>Nha Trang</diaChi>
            <moTa>...</moTa>
        </DiaDiem>
        <DiaDiem maDiaDiem="DD007">
            <tenDiaDiem>Thung lũng Tình Yêu</tenDiaDiem>
            <diaChi>Đà Lạt</diaChi>
            <moTa>...</moTa>
        </DiaDiem>
        <DiaDiem maDiaDiem="DD008">
            <tenDiaDiem>Bãi Sao</tenDiaDiem>
            <diaChi>Phú Quốc</diaChi>
            <moTa>...</moTa>
        </DiaDiem>
        <DiaDiem maDiaDiem="DD009">
            <tenDiaDiem>Fansipan</tenDiaDiem>
            <diaChi>Sapa</diaChi>
            <moTa>...</moTa>
        </DiaDiem>
        <DiaDiem maDiaDiem="DD010">
            <tenDiaDiem>Chợ nổi Cái Răng</tenDiaDiem>
            <diaChi>Cần Thơ</diaChi>
            <moTa>...</moTa>
        </DiaDiem>
        <DiaDiem maDiaDiem="DD011">
            <tenDiaDiem>Bến Ninh Kiều</tenDiaDiem>
            <diaChi>Cần Thơ</diaChi>
            <moTa>...</moTa>
        </DiaDiem>
        <DiaDiem maDiaDiem="DD012">
            <tenDiaDiem>Núi Bà Đen</tenDiaDiem>
            <diaChi>Tây Ninh</diaChi>
            <moTa>...</moTa>
        </DiaDiem>
        <DiaDiem maDiaDiem="DD013">
            <tenDiaDiem>Làng hoa Sa Đéc</tenDiaDiem>
            <diaChi>Đồng Tháp</diaChi>
            <moTa>...</moTa>
        </DiaDiem>
        <DiaDiem maDiaDiem="DD014">
            <tenDiaDiem>Nhà công tử Bạc Liêu</tenDiaDiem>
            <diaChi>Bạc Liêu</diaChi>
            <moTa>...</moTa>
        </DiaDiem>
        <DiaDiem maDiaDiem="DD015">
            <tenDiaDiem>Chùa Dơi</tenDiaDiem>
            <diaChi>Sóc Trăng</diaChi>
            <moTa>...</moTa>
        </DiaDiem>
        <DiaDiem maDiaDiem="DD016">
            <tenDiaDiem>Vịnh Hạ Long</tenDiaDiem>
            <diaChi>Quảng Ninh</diaChi>
            <moTa>...</moTa>
        </DiaDiem>
        <DiaDiem maDiaDiem="DD017">
            <tenDiaDiem>Tượng Chúa Kitô</tenDiaDiem>
            <diaChi>Vũng Tàu</diaChi>
            <moTa>...</moTa>
        </DiaDiem>
        <DiaDiem maDiaDiem="DD018">
            <tenDiaDiem>Dinh Độc Lập</tenDiaDiem>
            <diaChi>TP. HCM</diaChi>
            <moTa>...</moTa>
        </DiaDiem>
        <DiaDiem maDiaDiem="DD019">
            <tenDiaDiem>Động Phong Nha</tenDiaDiem>
            <diaChi>Quảng Bình</diaChi>
            <moTa>...</moTa>
        </DiaDiem>
        <DiaDiem maDiaDiem="DD020">
            <tenDiaDiem>Mũi Cà Mau</tenDiaDiem>
            <diaChi>Cà Mau</diaChi>
            <moTa>...</moTa>
        </DiaDiem>
    </DSDiaDiem>

    <!-- Danh sách hướng dẫn viên -->
    <DSHuongDanVien>
        <HuongDanVien maHdv="HDV001">
            <tenHuongDanVien>Phạm Thị Cúc</tenHuongDanVien>
            <ngaySinh>15-05-1990</ngaySinh>
            <soDienThoai>0912345678</soDienThoai>
            <ngoaiNgu>Tiếng Anh</ngoaiNgu>
        </HuongDanVien>
        <HuongDanVien maHdv="HDV002">
            <tenHuongDanVien>Trần Thị Mai</tenHuongDanVien>
            <ngaySinh>25-07-1990</ngaySinh>
            <soDienThoai>0902234567</soDienThoai>
            <ngoaiNgu>Tiếng Trung</ngoaiNgu>
        </HuongDanVien>
        <HuongDanVien maHdv="HDV003">
            <tenHuongDanVien>Lê Văn An</tenHuongDanVien>
            <ngaySinh>10-11-1988</ngaySinh>
            <soDienThoai>0903345678</soDienThoai>
            <ngoaiNgu>Tiếng Nhật</ngoaiNgu>
        </HuongDanVien>
        <HuongDanVien maHdv="HDV004">
            <tenHuongDanVien>Phạm Thị Lan</tenHuongDanVien>
            <ngaySinh>02-05-1992</ngaySinh>
            <soDienThoai>0904456789</soDienThoai>
            <ngoaiNgu>Tiếng Hàn</ngoaiNgu>
        </HuongDanVien>
        <HuongDanVien maHdv="HDV005">
            <tenHuongDanVien>Đỗ Minh Tuấn</tenHuongDanVien>
            <ngaySinh>18-01-1987</ngaySinh>
            <soDienThoai>0905567890</soDienThoai>
            <ngoaiNgu>Tiếng Anh</ngoaiNgu>
        </HuongDanVien>
        <HuongDanVien maHdv="HDV006">
            <tenHuongDanVien>Nguyễn Thị Hoa</tenHuongDanVien>
            <ngaySinh>20-09-1993</ngaySinh>
            <soDienThoai>0906678901</soDienThoai>
            <ngoaiNgu>Tiếng Pháp</ngoaiNgu>
        </HuongDanVien>
        <HuongDanVien maHdv="HDV007">
            <tenHuongDanVien>Trần Văn Minh</tenHuongDanVien>
            <ngaySinh>14-06-1989</ngaySinh>
            <soDienThoai>0907789012</soDienThoai>
            <ngoaiNgu>Tiếng Nga</ngoaiNgu>
        </HuongDanVien>
        <HuongDanVien maHdv="HDV008">
            <tenHuongDanVien>Lý Thị Thảo</tenHuongDanVien>
            <ngaySinh>08-12-1991</ngaySinh>
            <soDienThoai>0908890123</soDienThoai>
            <ngoaiNgu>Tiếng Anh</ngoaiNgu>
        </HuongDanVien>
        <HuongDanVien maHdv="HDV009">
            <tenHuongDanVien>Phan Thanh Hùng</tenHuongDanVien>
            <ngaySinh>05-04-1986</ngaySinh>
            <soDienThoai>0909901234</soDienThoai>
            <ngoaiNgu>Tiếng Trung</ngoaiNgu>
        </HuongDanVien>
        <HuongDanVien maHdv="HDV010">
            <tenHuongDanVien>Võ Thị Yến</tenHuongDanVien>
            <ngaySinh>21-07-1994</ngaySinh>
            <soDienThoai>0911012345</soDienThoai>
            <ngoaiNgu>Tiếng Hàn</ngoaiNgu>
        </HuongDanVien>
        <HuongDanVien maHdv="HDV011">
            <tenHuongDanVien>Nguyễn Văn Quang</tenHuongDanVien>
            <ngaySinh>12-02-1983</ngaySinh>
            <soDienThoai>0912123456</soDienThoai>
            <ngoaiNgu>Tiếng Nhật</ngoaiNgu>
        </HuongDanVien>
        <HuongDanVien maHdv="HDV012">
            <tenHuongDanVien>Trần Thị Bích</tenHuongDanVien>
            <ngaySinh>03-03-1990</ngaySinh>
            <soDienThoai>0913234567</soDienThoai>
            <ngoaiNgu>Tiếng Pháp</ngoaiNgu>
        </HuongDanVien>